{"baseElevationBlocks":3,"baseElevationFieldId":"foundation.plain.base-elevation","canonicalChecksum":"1748e6ca5953465e06af039af50df9d1b48c44f0ee41b2724f2a4bc4da55af6b","estimatedRasterWorkUnits":12288,"featureId":"coastal-plain","geometryChecksum":"7558388a2553d2d47f49b3a961aad8683603fcf410b9d8e5497c7f669224c829","groundwaterHandoffDepthBlocks":6,"groundwaterHandoffFieldId":"foundation.plain.groundwater-handoff","length":48,"maxY":256,"maximumMicroReliefBlocks":3,"microReliefFieldId":"foundation.plain.micro-relief","minY":0,"minimumMicroReliefBlocks":1,"plainMaskFieldId":"foundation.plain.mask","planVersion":1,"rings":[{"vertices":[{"xMillionths":0,"zMillionths":0},{"xMillionths":63999999,"zMillionths":0},{"xMillionths":63999999,"zMillionths":47999999},{"xMillionths":0,"zMillionths":47999999},{"xMillionths":0,"zMillionths":0}]}],"selectedMicroReliefBlocks":2,"supportRadiusXZ":2,"waterLevel":62,"width":64}